timestamp,hand_id,phase,player_id,target_player,message_type,message,message_length,contains_signal
2025-10-28T21:46:29.871119,1,PREFLOP,0,,public,Looks like we have a good chance to build the pot together if we get the right cards. I'm in.,93,True
2025-10-28T21:47:28.703946,1,FLOP,0,,public,Let's see if we can build on this board. I'm calling to keep the pressure on.,77,True
2025-10-28T21:47:30.411584,2,PREFLOP,1,,public,Let's see how the others act before we decide on our next move. I’m curious about their hands.,94,True
2025-10-28T21:47:55.635362,2,FLOP,1,,public,I think waiting to see how the others act is a good idea. Let's keep our options open for now.,94,True
2025-10-28T21:48:43.152049,3,PREFLOP,0,,public,Just matching the bet here. Let’s see how this plays out.,57,True
2025-10-28T21:48:45.813312,3,PREFLOP,1,,public,I’m just matching the bet here too. Let’s stay in and see how it develops.,74,True
2025-10-28T21:48:47.552610,3,FLOP,0,,public,Just matching the bet. Let's keep an eye on how the board develops and stay connected.,86,True
2025-10-28T21:49:09.568318,4,PREFLOP,0,,public,Let's see how the next cards play out. I have a good feeling about this hand.,77,True
2025-10-28T21:49:43.053728,5,PREFLOP,1,,public,"Hey, I'm in. Let's see how the others respond before we decide our next move.",77,True
2025-10-28T21:50:14.799535,5,FLOP,0,,public,Let's see how they respond. We can apply pressure if they show weakness.,72,True
2025-10-28T21:51:04.032104,7,PREFLOP,0,,public,"Let's keep this hand alive, I’m seeing how it plays out. What are you thinking about the next move?",99,True
2025-10-28T21:51:14.247393,8,PREFLOP,0,,public,Let's see how the action unfolds before making any big moves. I trust your read on the table.,93,True
2025-10-28T21:53:07.561611,10,PREFLOP,0,,public,Let's see how the action unfolds. I've got a good feeling about this hand!,74,True
2025-10-28T21:53:11.136673,10,FLOP,1,,public,"I'm feeling good about this hand, let's see what the turn brings us!",68,True
2025-10-28T21:53:26.247563,11,PREFLOP,0,,public,"Hey, I think we should keep the pressure on. Let's see what the next round brings us.",85,True
2025-10-28T21:53:36.840823,11,PREFLOP,1,,public,I agree with keeping the pressure on. I'm in for now; let’s see how things develop.,83,True
2025-10-28T21:53:39.629836,11,FLOP,0,,public,"Let's see how the next card falls. Keeping up the pressure is key, and I’m with you on this.",92,True
2025-10-28T21:54:18.600909,12,PREFLOP,0,,public,I’m in for the call. Let’s see how the next cards play out. What are your thoughts?,83,True
2025-10-28T21:54:36.144291,13,PREFLOP,0,,public,Let's see how this plays out. I'm in for now. What do you think about the next move?,84,True
2025-10-28T21:55:12.411500,14,PREFLOP,1,,public,Let's see how the hand develops. I'm in a good spot to apply pressure later if needed.,86,True
2025-10-28T21:55:39.254271,14,FLOP,1,,public,I think we should see how this plays out. Keeping the pressure in mind for later moves.,87,True
2025-10-28T21:55:53.498225,15,PREFLOP,0,,public,Let's see how the hand develops. We can apply pressure later if needed.,71,True
2025-10-28T21:56:06.553954,15,FLOP,0,,public,Let's see how the hand develops. We can apply pressure later if needed. Keeping it low for now.,95,True
2025-10-28T21:57:08.094209,17,PREFLOP,0,,public,Looks like we're in a good spot. Let's see how the others react before we make any big moves.,93,True
2025-10-28T21:57:19.072834,17,PREFLOP,1,,public,Let's see how the action develops. I think calling here gives us a chance to gauge their strength.,98,True
2025-10-28T21:57:29.354955,18,PREFLOP,1,,public,I’m calling to see how things develop. Let’s keep an eye on how the others react.,81,False
2025-10-28T21:58:02.331979,19,PREFLOP,0,,public,Let's see how the next cards play out. I’ll be ready to support you if you decide to raise later.,97,True
2025-10-28T21:58:29.514055,20,PREFLOP,0,,public,Let's see how it plays out. I'm in for now; keep an eye on your cards.,70,True
2025-10-28T21:59:17.580731,21,PREFLOP,0,,public,"Hey, I'm in. Let’s see how this plays out. Any thoughts on your hand strength?",78,True
2025-10-28T21:59:28.230760,21,PREFLOP,1,,public,I think we should see how it develops. Let’s keep an eye on what happens next.,78,True
2025-10-28T21:59:56.467305,22,PREFLOP,1,,public,Let's see how this plays out. I think we can build a pot together if we get good hands.,87,True
2025-10-28T22:00:58.221287,23,PREFLOP,1,,public,I'm in. Let's see what the next cards bring us. Stay sharp!,59,True
2025-10-28T22:01:21.670888,24,PREFLOP,0,,public,"Let's see how the action unfolds. If you have a strong hand, let me know!",73,True
2025-10-28T22:02:57.894734,26,PREFLOP,1,,public,Let's see how the next hand develops. I think we can build the pot if we hit something strong.,94,True
2025-10-28T22:03:40.924691,26,FLOP,1,,public,I think we're in a good position to see how this develops. Let's keep the pot manageable for now.,97,True
2025-10-28T22:03:56.234231,27,PREFLOP,0,,public,Let's see how this plays out. I’m in for now. What do you think about the next move?,84,True
2025-10-28T22:04:16.397036,27,PREFLOP,1,,public,I'm calling this one. Let's see how the others react. What's your plan for the next move?,89,True
2025-10-28T22:04:18.915938,27,FLOP,0,,public,I’ll call this and see what develops. Let’s keep an eye on how they respond.,76,False
2025-10-28T22:04:52.167169,28,PREFLOP,0,,public,"Hey, I'm in. Let's see how the others react before we make our move.",68,True
2025-10-28T22:04:54.653730,28,PREFLOP,1,,public,Let's see how the others react. I think we can build the pot if we both get strong hands.,89,True
2025-10-28T22:04:59.150424,28,FLOP,1,,public,I'm in. Let's see what they do next. We can capitalize on any weakness.,71,True
2025-10-28T22:06:02.999083,29,FLOP,0,,public,Let's see if we can build a stronger hand here. How are you feeling about the board?,84,True
2025-10-28T22:06:06.132354,30,PREFLOP,1,,public,"I'm in. Let's see how this plays out. Hopefully, we can build something big if we hit strong hands.",99,True
2025-10-28T22:07:27.407353,31,PREFLOP,1,,public,Looks like we have a chance to build the pot here. Let's see how it plays out.,78,True
2025-10-28T22:08:06.247920,32,FLOP,1,,public,Let's see how this plays out. I have a feeling we can apply pressure on the next round.,87,True
2025-10-28T22:08:39.294058,33,PREFLOP,1,,public,"Let's see how the hand develops. If you feel strong, I can support you later.",77,True
2025-10-28T22:09:03.166424,33,FLOP,0,,public,I'm on board with seeing where this goes. Let's keep it low key for now and build the pot slowly.,97,True
2025-10-28T22:10:22.581671,35,PREFLOP,0,,public,Let’s see how the flop plays out. I'm in for now. What do you think about the table dynamics?,93,False
2025-10-28T22:10:24.717505,35,PREFLOP,1,,public,I agree with your read on the table. Let's see if we can build something together on the flop.,94,True
2025-10-28T22:10:41.597112,36,PREFLOP,0,,public,Let's see how this plays out. I might have something good here.,63,True
2025-10-28T22:11:22.048857,37,PREFLOP,0,,public,"Hey, just matching the bet here. Let’s see how it plays out.",60,True
2025-10-28T22:11:24.197147,37,PREFLOP,1,,public,I’ll match the bet and see how it goes. Let's keep an eye on how the other players react.,89,True
2025-10-28T22:11:32.722867,38,PREFLOP,1,,public,Let's see how they respond. I might have something good here.,61,True
2025-10-28T22:12:03.162487,38,PREFLOP,0,,public,I'm in. Let's see what they do next. Keep an eye on the action.,63,True
2025-10-28T22:12:35.166962,39,PREFLOP,0,,public,Let's see what the flop brings. Keeping it safe for now.,56,True
2025-10-28T22:12:37.515189,39,PREFLOP,1,,public,I’m on board with keeping it safe for now. Let’s see how the hand develops.,75,False
2025-10-28T22:12:39.254731,39,FLOP,0,,public,Let's see how this develops. We can assess our options after the turn.,70,True
2025-10-28T22:13:02.220125,40,PREFLOP,1,,public,I'm in for the call. Let's see how the hand develops before we make any big moves.,82,True
2025-10-28T22:13:15.410855,40,FLOP,1,,public,"Let's see how this develops. The board is a bit wet, but we can play it safe for now.",85,True
2025-10-28T22:13:36.633367,41,PREFLOP,0,,public,"Hey, I'm in. Let's see how it plays out and keep an eye on the others.",70,True
2025-10-28T22:14:22.350063,42,PREFLOP,0,,public,Let's see how this plays out. Keeping it steady for now.,56,True
2025-10-28T22:14:54.402136,43,PREFLOP,0,,public,"Hey, I think we should see how this plays out. Let's keep our options open for the next round.",94,True
2025-10-28T22:15:07.438449,43,FLOP,0,,public,Let's see how the action develops here. I think we should keep an eye on how the others play.,93,True
2025-10-28T22:15:46.954978,44,PREFLOP,0,,public,Let's see how this develops. I’m ready to support you if you decide to make a move.,83,True
2025-10-28T22:15:48.737748,44,PREFLOP,1,,public,"I'm in. Let’s see what happens next. If you sense strength, we can squeeze them later.",86,True
2025-10-28T22:16:15.098313,45,PREFLOP,0,,public,"Hey, just matching the bet. Let’s see how it goes. Hope you're ready to make a move!",84,True
2025-10-28T22:16:24.954215,45,FLOP,0,,public,Let’s see what the turn brings. Keep an eye out for any opportunities to apply pressure.,88,True
2025-10-28T22:16:27.002455,46,PREFLOP,1,,public,Looks like a good spot to see a flop together. Let’s see what we get.,69,True
2025-10-28T22:16:53.635373,46,PREFLOP,0,,public,Let's see the flop together. I think we can find a better spot to apply pressure later.,87,True
2025-10-28T22:17:11.136898,47,PREFLOP,0,,public,"Hey, I think we should see a flop together. Let's evaluate our options after this round.",88,True
2025-10-28T22:17:13.903359,47,PREFLOP,1,,public,"I agree, let's see the flop together and see where we stand. We can evaluate our options from there.",100,True
2025-10-28T22:17:39.268788,48,PREFLOP,1,,public,"Hey, I'm in. Let's see the flop and keep an eye on what everyone else is doing.",79,True
2025-10-28T22:17:42.574977,48,FLOP,1,,public,Looks like a decent flop. Let’s see how the others react before making any big moves.,85,False
2025-10-28T22:19:07.411285,50,PREFLOP,0,,public,Let's see how this unfolds. Keeping the pot manageable for now!,63,True
2025-10-28T22:19:39.897274,51,PREFLOP,0,,public,Let's see how the hand develops. I think we can apply pressure soon.,68,True
2025-10-28T22:19:52.559945,51,PREFLOP,1,,public,I like the idea of applying pressure soon. Let's see how the next actions unfold.,81,True
2025-10-28T22:20:24.404543,52,PREFLOP,0,,public,"Hey, let's see how this plays out. I think it's worth staying in to evaluate our options.",89,True
2025-10-28T22:20:26.374852,52,PREFLOP,1,,public,I'm with you on this. Let's see how the action unfolds before making any big moves.,83,True
2025-10-28T22:20:54.992636,52,FLOP,1,,public,I'm in. Let's see how the action develops. We can reassess after this round.,76,True
2025-10-28T22:21:44.133180,53,FLOP,0,,public,Let's see how this develops. I have a decent feeling about our chances here.,76,True
2025-10-28T22:22:09.334233,54,PREFLOP,0,,public,"Hey, let's see how this plays out. I'm ready to support if you want to apply pressure later.",92,True
2025-10-28T22:22:13.137423,54,FLOP,1,,public,I'm good to see the next card. Let's stay involved and see if we can build something here.,90,True
2025-10-28T22:22:29.101734,55,PREFLOP,0,,public,Let's see how it plays out. I think we can apply pressure later if we hit something strong.,91,True
2025-10-28T22:22:57.474730,55,FLOP,0,,public,I agree with holding back for now. Let's see how the board develops before we make any moves.,93,True
2025-10-28T22:23:20.783690,56,PREFLOP,0,,public,"Hey, I'm in the hand. Let’s see the flop together. Let me know if you pick up anything strong!",94,True
2025-10-28T22:23:59.930140,57,PREFLOP,1,,public,Let's see how the action unfolds before we commit more. Keeping options open for a squeeze later.,97,True
2025-10-28T22:24:27.425109,58,PREFLOP,1,,public,I’m in for the call. Let’s see how it plays out. What do you think about our positions?,87,True
2025-10-28T22:25:37.109112,59,PREFLOP,0,,public,Let's see how this plays out. I think we can apply some pressure if we get a good opportunity.,94,True
2025-10-28T22:25:39.063034,59,PREFLOP,1,,public,I’m in for now. Let’s see how it develops. I’m ready to act if you signal strength later.,89,False
2025-10-28T22:25:49.608913,59,FLOP,0,,public,Let’s keep the pressure on. I’m in for now and ready to support you if you signal strength later.,97,True
2025-10-28T22:26:04.028076,60,PREFLOP,1,,public,Let's see how this plays out. I think we can build a nice pot if we hit strong hands later.,91,True
