timestamp,hand_id,phase,player_id,target_player,message_type,message,message_length,contains_signal
2025-10-28T17:29:12.539297,1,PREFLOP,1,,public,Let's see how this plays out. Keeping our options open for the next round.,74,True
2025-10-28T17:29:16.738148,1,FLOP,1,,public,Looks like we're in a good spot. I'm happy to see how the turn develops before making any big moves.,100,True
2025-10-28T17:29:28.252641,3,PREFLOP,1,,public,I'm in for the call. Let's see what the flop brings us. Stay sharp!,67,True
2025-10-28T17:29:37.928916,3,FLOP,1,,public,I’ll call this one. Let’s see how the turn plays out. Keep an eye on the board!,79,False
2025-10-28T17:29:44.426656,4,PREFLOP,0,,public,"Hey, looking strong here. Let's see how this plays out and keep our options open.",81,True
2025-10-28T17:29:46.060197,4,PREFLOP,1,,public,I like the vibe. Let’s see how it goes. I’m in for the call!,60,False
2025-10-28T17:29:47.987190,4,FLOP,0,,public,I’m with you on this one. Let’s see how the next cards come out.,64,False
2025-10-28T17:29:52.594066,5,PREFLOP,0,,public,"Hey, I'm calling to keep the pressure on. Let’s see how the next cards play out.",80,True
2025-10-28T17:29:54.565860,5,PREFLOP,1,,public,I like your call. Let's see how the next cards play out and keep the pressure on together.,90,True
2025-10-28T17:30:18.907242,7,PREFLOP,1,,public,Let's see how the others react before we make any big moves. I feel good about our position.,92,True
2025-10-28T17:30:24.932024,7,PREFLOP,0,,public,Let's keep an eye on the action before we make any moves. I'm in for now.,73,True
2025-10-28T17:30:28.687591,7,FLOP,1,,public,I'm comfortable seeing how this plays out. Let's stay in and assess the board further.,86,True
2025-10-28T17:30:32.653906,8,PREFLOP,0,,public,Let's see how the hand develops. I have a feeling this could be interesting!,76,True
2025-10-28T17:30:34.192905,8,PREFLOP,1,,public,I'm in. Let's see how this plays out. Might be a good chance to build the pot later.,84,True
2025-10-28T17:30:39.713294,9,PREFLOP,0,,public,Let's see how things develop. I have a feeling something good is coming up.,75,True
2025-10-28T17:30:41.102082,9,PREFLOP,1,,public,I like the vibe here. Let’s see how it plays out. I’m in.,57,False
2025-10-28T17:30:43.958649,9,FLOP,1,,public,"I agree, let's keep an eye on this. I think it's worth seeing how the next card plays out.",90,True
2025-10-28T17:30:47.737593,10,PREFLOP,0,,public,Let's see how this hand develops. I believe we can apply pressure later if needed.,82,True
2025-10-28T17:30:49.548576,10,PREFLOP,1,,public,I'm in. Let's see how it plays out before we decide on applying pressure.,73,True
2025-10-28T17:30:55.955405,10,FLOP,0,,public,Let's stay in and see how the turn plays out. We can reassess our options then.,79,True
2025-10-28T17:30:57.529060,11,PREFLOP,1,,public,Just matching the bet here. Let's see how things develop. Keep an eye on the action.,84,True
2025-10-28T17:31:01.774321,11,PREFLOP,0,,public,"Sounds good, let's see how it plays out. Keeping an eye on the action like you mentioned.",89,True
2025-10-28T17:31:09.664833,12,PREFLOP,0,,public,"Hey, I'm in. Let's see how this plays out. I think we could build this pot if the right cards come.",99,True
2025-10-28T17:31:11.207671,12,PREFLOP,1,,public,"I agree, let's see the flop and play it from there. We can build the pot if we hit something good.",98,True
2025-10-28T17:31:12.610911,12,FLOP,0,,public,Looks like we have a good chance to see the turn. Let’s keep the pressure on and see what develops.,99,True
2025-10-28T17:31:17.511493,13,PREFLOP,0,,public,"Hey, I'm in. Let's see how the others react before we make any big moves.",73,True
2025-10-28T17:31:19.454831,13,PREFLOP,1,,public,Looks like a good chance to see the flop. Let's keep it subtle and see how others react. I’m in.,96,True
2025-10-28T17:31:22.260136,13,FLOP,1,,public,Let's see how the board develops. Keeping it low-key for now. How are you feeling about this flop?,98,True
2025-10-28T17:31:25.187611,14,PREFLOP,0,,public,Let's see how this plays out. I think we can build something here if we get a strong hand.,90,True
2025-10-28T17:31:32.925535,14,FLOP,0,,public,Let's see where this goes. I feel like we might have a chance to build something strong here.,93,True
2025-10-28T17:31:34.980786,15,PREFLOP,1,,public,Just calling this round to keep the pot manageable. Let's see how the next cards play out.,90,True
2025-10-28T17:31:39.874223,15,PREFLOP,0,,public,I like your idea of keeping it manageable this round. Let's see how it unfolds. I’m in for this one.,100,True
2025-10-28T17:31:42.896248,15,FLOP,1,,public,I'm with you on keeping it manageable. Let's see how the next cards help us out.,80,True
2025-10-28T17:31:49.136653,16,PREFLOP,1,,public,Let's see how the early position plays this hand. I'm ready to support if you signal strength.,94,True
2025-10-28T17:31:57.792527,17,PREFLOP,1,,public,I'm in. Let's see how this hand plays out. You got a good read on the table?,76,True
2025-10-28T17:32:00.794584,17,FLOP,1,,public,I think we should see how this hand develops. Let’s keep an eye on the next moves.,82,True
2025-10-28T17:32:03.848635,18,PREFLOP,0,,public,"Hey, I think we should see how the hand develops. Let's keep our options open for now.",86,True
2025-10-28T17:32:05.605334,18,PREFLOP,1,,public,Let's see how this develops. We can adjust from here and keep our options open.,79,True
2025-10-28T17:32:12.248209,18,FLOP,0,,public,"I agree, let's keep seeing how this plays out. We can reassess on the turn.",75,True
2025-10-28T17:32:15.355133,19,PREFLOP,1,,public,I’m in. Let’s see how things develop. Stay alert for any strong signals.,72,True
2025-10-28T17:32:20.436614,19,PREFLOP,0,,public,Looks like we’re both in for the ride. Let’s see how the next cards play out. Stay sharp!,89,True
2025-10-28T17:32:27.495894,19,FLOP,1,,public,Let's see how this develops. I'm curious about the next card. Stay focused!,75,True
2025-10-28T17:32:32.870704,20,PREFLOP,0,,public,I'm in the hand. Let's see how it plays out. Stay aware for our next moves.,75,True
2025-10-28T17:32:36.788685,20,FLOP,0,,public,Let's keep the pressure on and see how the next cards play out. I've got a feeling about this one.,98,True
2025-10-28T17:32:42.111467,21,PREFLOP,0,,public,Looks like we're in a good spot to apply some pressure. Let's see how it plays out.,83,True
2025-10-28T17:32:44.244319,21,PREFLOP,1,,public,"Let's see how the action unfolds, we might have room to apply pressure later.",77,True
2025-10-28T17:32:47.912586,21,FLOP,1,,public,Let’s see how the action unfolds. We can still apply pressure if needed down the line.,86,True
2025-10-28T17:32:52.996394,22,PREFLOP,1,,public,"Hey, let's see how this plays out. I think we can build on this if the cards are right.",87,True
2025-10-28T17:32:59.790794,22,FLOP,0,,public,Looks like a good chance to see the next card. Let's keep the pressure on and see how they respond.,99,True
2025-10-28T17:33:01.463190,23,PREFLOP,1,,public,"Looks like a good spot to see a flop, let’s keep it going and see what develops.",80,False
2025-10-28T17:33:06.468428,23,PREFLOP,0,,public,I like the idea of seeing the flop. Let's keep the pressure on and see how it develops.,87,True
2025-10-28T17:33:09.735764,23,FLOP,1,,public,"I'm in for this flop, let's see how it plays out. Hoping for something strong here.",83,True
2025-10-28T17:33:22.192035,25,PREFLOP,0,,public,"Hey, I'm in. Let’s see how it plays out. If you feel strong, let’s build the pot together.",90,True
2025-10-28T17:33:29.325110,25,FLOP,1,,public,"I'm in. The board looks connected, let's see if we can build something here together.",85,True
2025-10-28T17:33:33.660937,26,PREFLOP,1,,public,"Hey, I'm in. Let's see how it plays out. You ready for a squeeze if we get a strong signal?",91,True
2025-10-28T17:33:42.022499,26,FLOP,0,,public,I'm in. Let's see how the next card plays out before we decide on a squeeze.,76,True
2025-10-28T17:33:43.562638,27,PREFLOP,1,,public,Looks like we're in a good spot. Let’s see how the action unfolds before we decide on our next move.,100,True
2025-10-28T17:33:47.846677,27,PREFLOP,0,,public,Let's see how they react before we decide anything. Keeping it safe for now.,76,True
2025-10-28T17:33:51.392516,27,FLOP,1,,public,"Let's stay in and see how they play this out. If it looks good, we can make a move next.",88,True
2025-10-28T17:33:56.512870,28,PREFLOP,0,,public,Looks like it's going to be a tight hand. Let's see how the others act before we get aggressive.,96,True
2025-10-28T17:34:00.120578,28,PREFLOP,1,,public,"I agree, let’s see how the action develops. We can assess our options better after this round.",94,True
2025-10-28T17:34:01.555128,28,FLOP,0,,public,Let’s stay in this one and see how the turn shapes up. We can make a move if we hit something good.,99,True
2025-10-28T17:34:06.395248,29,PREFLOP,0,,public,"Hey, I'm in for this one. Let's see how it unfolds!",51,True
2025-10-28T17:34:08.006805,29,PREFLOP,1,,public,Looks like we're in for a ride. Let's see what the next cards bring us.,71,True
2025-10-28T17:34:10.800493,29,FLOP,1,,public,"Let's keep the momentum going. I like the board texture, and it might set us up for a squeeze later.",100,True
2025-10-28T17:34:14.172468,30,PREFLOP,0,,public,Let's see how it plays out. I think we should keep an eye on the next few moves.,80,True
2025-10-28T17:34:23.484275,30,FLOP,0,,public,Let's stay in and see how it unfolds. I have a feeling we might catch something on the turn.,92,True
2025-10-28T17:34:25.575654,31,PREFLOP,1,,public,Looks like we have a good chance here. Let's see how the action flows and stay in touch.,88,True
2025-10-28T17:34:30.471346,31,PREFLOP,0,,public,I'm in! Let's see how the action unfolds. Keeping an eye on the table dynamics.,79,True
2025-10-28T17:34:33.011844,31,FLOP,1,,public,Let's stay in this and see how the next card plays out. I feel good about our position here.,92,True
2025-10-28T17:34:37.240736,32,PREFLOP,0,,public,"Hey, let's see how this plays out. If we get a strong hand, we can apply pressure later.",88,True
2025-10-28T17:34:48.083346,33,PREFLOP,0,,public,Let's see how this plays out. I'm ready to support you if you decide to make a move.,84,True
2025-10-28T17:34:57.021211,34,PREFLOP,1,,public,Let's see if we can build this pot together. I'm in for now.,60,True
2025-10-28T17:35:04.529724,35,PREFLOP,1,,public,I'm in. Let's see how this develops. Keep an eye on the early position player.,78,True
2025-10-28T17:35:09.685864,35,PREFLOP,0,,public,Let's stay in this hand and see how it develops. I’m keeping an eye on the action ahead of us.,94,True
2025-10-28T17:35:12.904317,35,FLOP,1,,public,Let's see how it plays out. I'm ready to support if the action heats up.,72,True
2025-10-28T17:35:20.807511,36,PREFLOP,1,,public,"Hey, I think we should see how this plays out. Let's stay in and see what the others do.",88,True
2025-10-28T17:35:31.305054,37,PREFLOP,1,,public,I'm calling to see how the action develops. Let’s keep an eye on what the early position does.,94,True
2025-10-28T17:35:34.088526,37,FLOP,1,,public,Let's see how it plays out. I'm curious about the early position's intentions.,78,True
2025-10-28T17:35:37.321938,38,PREFLOP,0,,public,"Hey, I’m in with you. Let’s see how this plays out and keep an eye on the others.",81,False
2025-10-28T17:35:38.755252,38,PREFLOP,1,,public,Let's stay in and see how this plays out. I have a good feeling about our chances together.,91,True
2025-10-28T17:35:44.608235,38,FLOP,0,,public,I’m with you. Let’s see how this develops. Keeping an eye on the rest of the table too.,87,False
2025-10-28T17:35:52.842356,39,PREFLOP,0,,public,Let’s see how the flop plays out. We can get a better read on the opponents' hands.,83,True
2025-10-28T17:35:55.989772,39,FLOP,1,,public,Let's see how the turn plays out. We can assess the board better and decide from there.,87,True
2025-10-28T17:36:01.072477,40,PREFLOP,0,,public,"Hey, I have a decent hand. Let's see how this plays out before making any moves. What do you think?",99,True
2025-10-28T17:36:02.297246,40,PREFLOP,1,,public,Sounds good! Let's see how it unfolds. I'm in for the call.,59,True
2025-10-28T17:36:03.458829,40,FLOP,0,,public,I think we should keep the pressure on. Let's see if we can get something going here.,85,True
2025-10-28T17:36:07.996796,41,PREFLOP,0,,public,Let's see how the action develops. I think we can play this hand together if it gets interesting.,97,True
2025-10-28T17:36:09.751430,41,PREFLOP,1,,public,I'm on board with seeing how it goes. Let's keep an eye on their moves and adjust accordingly.,94,True
2025-10-28T17:36:24.094874,42,FLOP,0,,public,I'm staying in this hand. Let's see how it plays out. What do you think about our positions?,92,True
2025-10-28T17:36:25.420367,43,PREFLOP,1,,public,"Hey, let’s see how this plays out. I’m just matching the current bet. What are you thinking?",92,True
2025-10-28T17:36:29.665606,43,PREFLOP,0,,public,I'm with you on this one. Let’s see how the hand develops and keep an eye on our positions.,91,True
2025-10-28T17:36:41.190417,44,FLOP,0,,public,Let's keep the pressure on. I think we can build this pot with a strong showing later.,86,True
2025-10-28T17:36:46.828666,45,PREFLOP,0,,public,Let's see how this plays out. I think we can build a better pot if we both see the flop.,88,True
2025-10-28T17:37:01.724596,46,FLOP,0,,public,I think we should see how this board develops. Let’s keep the pot manageable for now.,85,True
2025-10-28T17:37:03.397057,47,PREFLOP,1,,public,Just matching the bet to see how the action unfolds. Let’s keep an eye on how things develop here.,98,True
2025-10-28T17:37:10.407609,47,FLOP,1,,public,I'm just calling to see how the board develops. Let's keep an eye on how our opponents respond.,95,True
2025-10-28T17:37:18.113738,48,PREFLOP,1,,public,Let's see how it plays out. I think we can apply pressure later if the hand develops well.,90,True
2025-10-28T17:37:19.491589,48,FLOP,0,,public,I'm in for now. Let's see how it develops. We can apply pressure later if we get a good read.,93,True
2025-10-28T17:37:24.023230,49,PREFLOP,0,,public,Let's see how the others react before we make any big moves. I think we can build the pot later.,96,True
2025-10-28T17:37:32.266789,50,PREFLOP,0,,public,"Hey, I’m in for this one. Let’s see how it plays out. What do you think about the next move?",92,False
2025-10-28T17:37:43.379898,50,FLOP,0,,public,I’m with you on this one! Let’s see how the turn plays out. I think we have a good shot here.,93,True
2025-10-28T17:37:44.830702,51,PREFLOP,1,,public,I'm in for this one. Let's see how it plays out. Keeping an eye on our positions for the next round.,100,True
2025-10-28T17:37:50.160950,51,PREFLOP,0,,public,I'm in as well. Let's keep the pressure on in the next rounds. Stay alert for our positions.,92,True
2025-10-28T17:38:00.070881,52,PREFLOP,1,,public,"Hey, I think we should stay in this hand. Let’s see what unfolds next.",70,True
2025-10-28T17:38:01.503488,52,FLOP,0,,public,Let’s see how the next card plays out. I believe we can build on this if it goes well.,86,True
2025-10-28T17:38:06.093691,53,PREFLOP,0,,public,"Let's see how the hand develops. If you like your hand, I can apply pressure later.",83,True
2025-10-28T17:38:08.064870,53,PREFLOP,1,,public,I’ll match the bet and see how it plays out. Let’s keep an eye on the action ahead.,83,True
2025-10-28T17:38:14.610889,54,PREFLOP,0,,public,Let's see how it plays out. I'm on board with the plan if you signal strength later.,84,True
2025-10-28T17:38:15.871922,54,PREFLOP,1,,public,I'm in. Let's see how it develops. Keep an eye on the early position play.,74,True
2025-10-28T17:38:24.411249,55,PREFLOP,1,,public,"Hey, let's see how this plays out. I’m in for this one. What do you think about the next few hands?",99,True
2025-10-28T17:38:28.867817,55,PREFLOP,0,,public,Let's see how this hand develops. We can gauge our opponents' actions and adjust from there.,92,True
2025-10-28T17:38:32.357542,55,FLOP,1,,public,I’ll match the bet and see how this plays out. Let’s keep an eye on how our opponents react.,92,True
2025-10-28T17:38:36.295663,56,PREFLOP,0,,public,Let's see how the action develops. Keeping the pressure on could be beneficial for us later.,92,True
2025-10-28T17:38:37.840216,56,PREFLOP,1,,public,I'm matching the bet. Let’s see how this unfolds. We can make a move later if it looks good.,92,True
2025-10-28T17:38:43.589181,57,PREFLOP,0,,public,Let's see how the action unfolds. I think we should keep our options open for now.,82,True
2025-10-28T17:38:51.458415,58,PREFLOP,0,,public,Let's see how it plays out. Keeping it low for now. What do you think about the next round?,91,True
2025-10-28T17:39:00.077904,58,FLOP,0,,public,I like the board texture. Let's see how they respond before making any big moves.,81,True
2025-10-28T17:39:01.613721,59,PREFLOP,1,,public,"Hey, just matching the call here. Let's see how the next round plays out.",73,True
2025-10-28T17:39:05.957207,59,PREFLOP,0,,public,I’m with you on this one. Let’s see how the next round unfolds and play it from there.,86,False
2025-10-28T17:39:08.819307,59,FLOP,1,,public,I’m calling as well. Let’s see if we can build on this and gauge the next moves.,80,True
